{
  "title": "Communication and Navigation Outage Forecast System (CNOFS)",
  "source": {
    "provider": "nasa",
    "url": "https://raw.githubusercontent.com/nasa/NASA-3D-Resources/11ebb4ee043715aefbba6aeec8a61746fad67fa7/3D%20Models/Communication%20and%20Navigation%20Outage%20Forecast%20System%20%28CNOFS%29/Communication%20and%20Navigation%20Outage%20Forecast%20System%20%28CNOFS%29.glb",
    "revision": "11ebb4ee043715aefbba6aeec8a61746fad67fa7",
    "original_file": "3D Models/Communication and Navigation Outage Forecast System (CNOFS)/Communication and Navigation Outage Forecast System (CNOFS).glb"
  },
  "rights": {
    "label": "NASA media guidelines",
    "url": "https://www.nasa.gov/nasa-brand-center/images-and-media/",
    "credit": "NASA 3D Resources; individual contributor credit should be retained where supplied",
    "public_export": true,
    "note": "NASA repository asset declaration applies; no endorsement. Logos and third-party rights remain separate. Repository meta.json also names NOSA 1.3; retained for review."
  },
  "representation": "mission_visualization",
  "display": {
    "native_extent": null,
    "reference_extent_m": null,
    "scale_basis": "unverified; preview auto-fit only",
    "forward_axis": "unverified",
    "browser_measured_extent": 147.70002977439458,
    "preview_note": "Default full-scene thumbnail has a small silhouette. Dedicated framing/scale review recommended; browser loading is not a visual-quality certification."
  },
  "aliases": [],
  "conversion": {
    "operation": "none",
    "note": "Original GLB bytes preserved."
  },
  "schema_version": 1,
  "asset_id": "cnofs",
  "category": "spacecraft/satellites",
  "purpose": "visual_only",
  "model": {
    "path": "model.glb",
    "bytes": 1484180,
    "sha256": "2d4f6c296b59daa80b668c8d51481771648964bfa41c88fbf232c44f19618fbb"
  },
  "geometry": {
    "meshes": 25,
    "materials": 25,
    "animations": 0,
    "skins": 0,
    "required_extensions": [
      "KHR_draco_mesh_compression"
    ],
    "native_coordinates": "glTF right-handed +Y up; forward axis is asset-specific",
    "physical_dimensions_verified": false,
    "rendered_triangles": 605926
  },
  "validation": {
    "container": "passed",
    "gltf_validator": "passed",
    "browser": "passed",
    "gltf_validator_version": "2.0.0-dev.3.10",
    "gltf_errors": 0,
    "gltf_warnings": 0,
    "browser_scope": "Default scene load, shader compilation and one rendered frame. No animation/scale/flight-direction certification.",
    "browser_sha256": "2d4f6c296b59daa80b668c8d51481771648964bfa41c88fbf232c44f19618fbb"
  },
  "thumbnail": {
    "path": "thumbnail.jpg",
    "bytes": 2213,
    "sha256": "23ac2f7f7317b527733139c7cd99a610c356e7a12f16dfa1853dda7f1954838c"
  }
}
