{
  "title": "Ice, Clouds, and Land Elevation Satellite (ICESat) (A)",
  "source": {
    "provider": "nasa",
    "url": "https://raw.githubusercontent.com/nasa/NASA-3D-Resources/11ebb4ee043715aefbba6aeec8a61746fad67fa7/3D%20Models/Ice%2C%20Clouds%2C%20and%20Land%20Elevation%20Satellite%20%28ICESat%29%20%28A%29/Ice%2C%20Clouds%2C%20and%20Land%20Elevation%20Satellite%20%28ICESat%29%20%28A%29.glb",
    "revision": "11ebb4ee043715aefbba6aeec8a61746fad67fa7",
    "original_file": "3D Models/Ice, Clouds, and Land Elevation Satellite (ICESat) (A)/Ice, Clouds, and Land Elevation Satellite (ICESat) (A).glb"
  },
  "rights": {
    "label": "NASA media guidelines",
    "url": "https://www.nasa.gov/nasa-brand-center/images-and-media/",
    "credit": "NASA 3D Resources; individual contributor credit should be retained where supplied",
    "public_export": true,
    "note": "NASA repository asset declaration applies; no endorsement. Logos and third-party rights remain separate. Repository meta.json also names NOSA 1.3; retained for review."
  },
  "representation": "mission_visualization",
  "display": {
    "native_extent": null,
    "reference_extent_m": null,
    "scale_basis": "unverified; preview auto-fit only",
    "forward_axis": "unverified",
    "browser_measured_extent": 35.599998474121094
  },
  "aliases": [],
  "conversion": {
    "operation": "none",
    "note": "Original GLB bytes preserved."
  },
  "schema_version": 1,
  "asset_id": "icesat",
  "category": "spacecraft/satellites",
  "purpose": "visual_only",
  "model": {
    "path": "model.glb",
    "bytes": 1151936,
    "sha256": "8843f2a22fd0f836b9d2374f60909276d28cb6909ca36f52db82fe01684958b1"
  },
  "geometry": {
    "meshes": 1,
    "materials": 9,
    "animations": 0,
    "skins": 0,
    "required_extensions": [],
    "native_coordinates": "glTF right-handed +Y up; forward axis is asset-specific",
    "physical_dimensions_verified": false,
    "rendered_triangles": 976
  },
  "validation": {
    "container": "passed",
    "gltf_validator": "passed",
    "browser": "passed",
    "gltf_validator_version": "2.0.0-dev.3.10",
    "gltf_errors": 0,
    "gltf_warnings": 0,
    "browser_scope": "Default scene load, shader compilation and one rendered frame. No animation/scale/flight-direction certification.",
    "browser_sha256": "8843f2a22fd0f836b9d2374f60909276d28cb6909ca36f52db82fe01684958b1"
  },
  "thumbnail": {
    "path": "thumbnail.jpg",
    "bytes": 6296,
    "sha256": "7cdc2ab8ef6c9813b1ae58bf3037aaf59fe66cce5bf9cc223a94d9e43597a225"
  }
}
