{
  "title": "Aeronomy of Ice in the Mesosphere",
  "source": {
    "provider": "nasa",
    "url": "https://raw.githubusercontent.com/nasa/NASA-3D-Resources/11ebb4ee043715aefbba6aeec8a61746fad67fa7/3D%20Models/Aeronomy%20of%20Ice%20in%20the%20Mesosphere/Aeronomy%20of%20Ice%20in%20the%20Mesosphere.glb",
    "revision": "11ebb4ee043715aefbba6aeec8a61746fad67fa7",
    "original_file": "3D Models/Aeronomy of Ice in the Mesosphere/Aeronomy of Ice in the Mesosphere.glb"
  },
  "rights": {
    "label": "NASA media guidelines",
    "url": "https://www.nasa.gov/nasa-brand-center/images-and-media/",
    "credit": "NASA 3D Resources; individual contributor credit should be retained where supplied",
    "public_export": true,
    "note": "NASA repository asset declaration applies; no endorsement. Logos and third-party rights remain separate. Repository meta.json also names NOSA 1.3; retained for review."
  },
  "representation": "mission_visualization",
  "display": {
    "native_extent": null,
    "reference_extent_m": null,
    "scale_basis": "unverified; preview auto-fit only",
    "forward_axis": "unverified",
    "browser_measured_extent": 41.400001525878906
  },
  "aliases": [],
  "conversion": {
    "operation": "none",
    "note": "Original GLB bytes preserved."
  },
  "schema_version": 1,
  "asset_id": "aim",
  "category": "spacecraft/satellites",
  "purpose": "visual_only",
  "model": {
    "path": "model.glb",
    "bytes": 323372,
    "sha256": "6e5b3d6bcfc7c75c33eac80b81771d413fcb265e4a3eaebaecabf34e8ff7e614"
  },
  "geometry": {
    "meshes": 1,
    "materials": 29,
    "animations": 0,
    "skins": 0,
    "required_extensions": [
      "KHR_draco_mesh_compression"
    ],
    "native_coordinates": "glTF right-handed +Y up; forward axis is asset-specific",
    "physical_dimensions_verified": false,
    "rendered_triangles": 132276
  },
  "validation": {
    "container": "passed",
    "gltf_validator": "passed",
    "browser": "passed",
    "gltf_validator_version": "2.0.0-dev.3.10",
    "gltf_errors": 0,
    "gltf_warnings": 0,
    "browser_scope": "Default scene load, shader compilation and one rendered frame. No animation/scale/flight-direction certification.",
    "browser_sha256": "6e5b3d6bcfc7c75c33eac80b81771d413fcb265e4a3eaebaecabf34e8ff7e614"
  },
  "thumbnail": {
    "path": "thumbnail.jpg",
    "bytes": 10531,
    "sha256": "d12031d16ec8599f1b6dff4d6cadec7b294072c2431a3455a50fef3b02a0b93a"
  }
}
