{
  "title": "TDRS 데이터 중계위성",
  "source": {
    "provider": "nasa",
    "url": "https://github.com/nasa/NASA-3D-Resources/blob/11ebb4ee043715aefbba6aeec8a61746fad67fa7/3D%20Models/Tracking and Data Relay Satellites (TRDS) (E)/Tracking and Data Relay Satellites (TRDS) (E).glb",
    "revision": "11ebb4ee043715aefbba6aeec8a61746fad67fa7",
    "imported_from": "icdcdt",
    "original_file": "tdrs.glb"
  },
  "rights": {
    "label": "NASA media guidelines",
    "credit": "NASA 3D Resources",
    "url": "https://www.nasa.gov/nasa-brand-center/images-and-media/",
    "public_export": true,
    "note": "NASA attribution; no endorsement. Trademarks and third-party rights remain separate."
  },
  "representation": "mission_visualization",
  "aliases": [
    {
      "key": "tdrs",
      "label": "TDRS 데이터 중계위성",
      "exact": {
        "norad": [],
        "names": []
      },
      "series": {
        "norad": [],
        "names": [
          "^TDRS \\d+$"
        ]
      },
      "family": {
        "names": []
      },
      "size_m": 17.3,
      "orientation": {
        "heading": 0,
        "pitch": 0,
        "roll": 0
      },
      "extent": 94.43994
    }
  ],
  "display": {
    "native_extent": 94.43994,
    "reference_extent_m": 17.3,
    "scale_basis": "ICDCDT approximate display dimensions; not certified measurements",
    "orientation": {
      "heading": 0,
      "pitch": 0,
      "roll": 0
    },
    "browser_measured_extent": 94.4399397777297
  },
  "conversion": {
    "operation": "none",
    "note": "Original GLB bytes preserved."
  },
  "schema_version": 1,
  "asset_id": "tdrs",
  "category": "spacecraft/satellites",
  "purpose": "visual_only",
  "model": {
    "path": "model.glb",
    "bytes": 216892,
    "sha256": "4508756798d827722608aa9001925f01ce6409b9e0fd910eacfde9c061139b9e"
  },
  "geometry": {
    "meshes": 1,
    "materials": 33,
    "animations": 0,
    "skins": 0,
    "required_extensions": [
      "KHR_draco_mesh_compression"
    ],
    "native_coordinates": "glTF right-handed +Y up; forward axis is asset-specific",
    "physical_dimensions_verified": false,
    "rendered_triangles": 66962
  },
  "validation": {
    "container": "passed",
    "gltf_validator": "passed",
    "browser": "passed",
    "gltf_validator_version": "2.0.0-dev.3.10",
    "gltf_errors": 0,
    "gltf_warnings": 0,
    "browser_scope": "Default scene load, shader compilation and one rendered frame. No animation/scale/flight-direction certification.",
    "browser_sha256": "4508756798d827722608aa9001925f01ce6409b9e0fd910eacfde9c061139b9e"
  },
  "thumbnail": {
    "path": "thumbnail.jpg",
    "bytes": 7877,
    "sha256": "1b243e4541df364acd2de06734ce8df88a642aca53a16056f226f741a357343d"
  }
}
