{
  "title": "Advanced Composition Explorer",
  "source": {
    "provider": "nasa",
    "url": "https://raw.githubusercontent.com/nasa/NASA-3D-Resources/11ebb4ee043715aefbba6aeec8a61746fad67fa7/3D%20Models/Advanced%20Composition%20Explorer/Advanced%20Composition%20Explorer.glb",
    "revision": "11ebb4ee043715aefbba6aeec8a61746fad67fa7",
    "original_file": "3D Models/Advanced Composition Explorer/Advanced Composition Explorer.glb"
  },
  "rights": {
    "label": "NASA media guidelines",
    "url": "https://www.nasa.gov/nasa-brand-center/images-and-media/",
    "credit": "NASA 3D Resources; individual contributor credit should be retained where supplied",
    "public_export": true,
    "note": "NASA repository asset declaration applies; no endorsement. Logos and third-party rights remain separate. Repository meta.json also names NOSA 1.3; retained for review."
  },
  "representation": "mission_visualization",
  "display": {
    "native_extent": null,
    "reference_extent_m": null,
    "scale_basis": "unverified; preview auto-fit only",
    "forward_axis": "unverified",
    "browser_measured_extent": 1345.3037109375
  },
  "aliases": [],
  "conversion": {
    "operation": "none",
    "note": "Original GLB bytes preserved."
  },
  "schema_version": 1,
  "asset_id": "ace",
  "category": "spacecraft/satellites",
  "purpose": "visual_only",
  "model": {
    "path": "model.glb",
    "bytes": 2030760,
    "sha256": "b03a394e57b6af3a1f3700f450d94a67dd3eaec8a00e125d2d005bd1359b6e9c"
  },
  "geometry": {
    "meshes": 1,
    "materials": 27,
    "animations": 0,
    "skins": 0,
    "required_extensions": [],
    "native_coordinates": "glTF right-handed +Y up; forward axis is asset-specific",
    "physical_dimensions_verified": false,
    "rendered_triangles": 25778
  },
  "validation": {
    "container": "passed",
    "gltf_validator": "passed",
    "browser": "passed",
    "gltf_validator_version": "2.0.0-dev.3.10",
    "gltf_errors": 0,
    "gltf_warnings": 0,
    "browser_scope": "Default scene load, shader compilation and one rendered frame. No animation/scale/flight-direction certification.",
    "browser_sha256": "b03a394e57b6af3a1f3700f450d94a67dd3eaec8a00e125d2d005bd1359b6e9c"
  },
  "thumbnail": {
    "path": "thumbnail.jpg",
    "bytes": 6645,
    "sha256": "3006851cb82c349b4dbad8edf04ea6f85a48c4b43107084a32ad7784e9177eb1"
  }
}
