{
  "title": "Wilkinson Microwave Anisotropy Probe (WMAP)",
  "source": {
    "provider": "nasa",
    "url": "https://raw.githubusercontent.com/nasa/NASA-3D-Resources/11ebb4ee043715aefbba6aeec8a61746fad67fa7/3D%20Models/Wilkinson%20Microwave%20Anisotropy%20Probe%20%28WMAP%29/Wilkinson%20Microwave%20Anisotropy%20Probe%20%28WMAP%29.glb",
    "revision": "11ebb4ee043715aefbba6aeec8a61746fad67fa7",
    "original_file": "3D Models/Wilkinson Microwave Anisotropy Probe (WMAP)/Wilkinson Microwave Anisotropy Probe (WMAP).glb"
  },
  "rights": {
    "label": "NASA media guidelines",
    "url": "https://www.nasa.gov/nasa-brand-center/images-and-media/",
    "credit": "NASA 3D Resources; individual contributor credit should be retained where supplied",
    "public_export": true,
    "note": "NASA repository asset declaration applies; no endorsement. Logos and third-party rights remain separate. Repository meta.json also names NOSA 1.3; retained for review."
  },
  "representation": "mission_visualization",
  "display": {
    "native_extent": null,
    "reference_extent_m": null,
    "scale_basis": "unverified; preview auto-fit only",
    "forward_axis": "unverified",
    "browser_measured_extent": 282.56610107421875
  },
  "aliases": [],
  "conversion": {
    "operation": "none",
    "note": "Original GLB bytes preserved."
  },
  "schema_version": 1,
  "asset_id": "wmap",
  "category": "spacecraft/satellites",
  "purpose": "visual_only",
  "model": {
    "path": "model.glb",
    "bytes": 1180264,
    "sha256": "e229741cec91e370cbc8be74bf41b66eff4f164ca18b0e08dbd6d6ed4f59aeca"
  },
  "geometry": {
    "meshes": 1,
    "materials": 61,
    "animations": 0,
    "skins": 0,
    "required_extensions": [
      "KHR_draco_mesh_compression"
    ],
    "native_coordinates": "glTF right-handed +Y up; forward axis is asset-specific",
    "physical_dimensions_verified": false,
    "rendered_triangles": 111746
  },
  "validation": {
    "container": "passed",
    "gltf_validator": "passed",
    "browser": "passed",
    "gltf_validator_version": "2.0.0-dev.3.10",
    "gltf_errors": 0,
    "gltf_warnings": 0,
    "browser_scope": "Default scene load, shader compilation and one rendered frame. No animation/scale/flight-direction certification.",
    "browser_sha256": "e229741cec91e370cbc8be74bf41b66eff4f164ca18b0e08dbd6d6ed4f59aeca"
  },
  "thumbnail": {
    "path": "thumbnail.jpg",
    "bytes": 8995,
    "sha256": "0d17bd655aef5dd593300821deb7276eb6d52e8cfe4354f299ce594ac4fbc780"
  }
}
