{
  "title": "Landsat 7",
  "source": {
    "provider": "nasa",
    "url": "https://github.com/nasa/NASA-3D-Resources/blob/11ebb4ee043715aefbba6aeec8a61746fad67fa7/3D%20Models/Landsat 7/Landsat 7.glb",
    "revision": "11ebb4ee043715aefbba6aeec8a61746fad67fa7",
    "imported_from": "icdcdt",
    "original_file": "landsat_7.glb"
  },
  "rights": {
    "label": "NASA media guidelines",
    "credit": "NASA 3D Resources",
    "url": "https://www.nasa.gov/nasa-brand-center/images-and-media/",
    "public_export": true,
    "note": "NASA attribution; no endorsement. Trademarks and third-party rights remain separate."
  },
  "representation": "mission_visualization",
  "aliases": [
    {
      "key": "landsat_7",
      "label": "Landsat 7",
      "exact": {
        "norad": [
          25682
        ],
        "names": [
          "^LANDSAT 7$"
        ]
      },
      "series": {
        "norad": [],
        "names": []
      },
      "family": {
        "names": []
      },
      "size_m": 9,
      "orientation": {
        "heading": 0,
        "pitch": 0,
        "roll": 0
      },
      "extent": 1.255568
    }
  ],
  "display": {
    "native_extent": 1.255568,
    "reference_extent_m": 9,
    "scale_basis": "ICDCDT approximate display dimensions; not certified measurements",
    "orientation": {
      "heading": 0,
      "pitch": 0,
      "roll": 0
    },
    "browser_measured_extent": 1.2555679803587196
  },
  "conversion": {
    "operation": "none",
    "note": "Original GLB bytes preserved."
  },
  "schema_version": 1,
  "asset_id": "landsat_7",
  "category": "spacecraft/satellites",
  "purpose": "visual_only",
  "model": {
    "path": "model.glb",
    "bytes": 160156,
    "sha256": "0ecb0a11a405d6f21a9cca60a65fdbaaaf1d00e026de50ad55e9074279829687"
  },
  "geometry": {
    "meshes": 4,
    "materials": 17,
    "animations": 0,
    "skins": 0,
    "required_extensions": [
      "KHR_draco_mesh_compression"
    ],
    "native_coordinates": "glTF right-handed +Y up; forward axis is asset-specific",
    "physical_dimensions_verified": false,
    "rendered_triangles": 40592
  },
  "validation": {
    "container": "passed",
    "gltf_validator": "passed",
    "browser": "passed",
    "gltf_validator_version": "2.0.0-dev.3.10",
    "gltf_errors": 0,
    "gltf_warnings": 0,
    "browser_scope": "Default scene load, shader compilation and one rendered frame. No animation/scale/flight-direction certification.",
    "browser_sha256": "0ecb0a11a405d6f21a9cca60a65fdbaaaf1d00e026de50ad55e9074279829687"
  },
  "thumbnail": {
    "path": "thumbnail.jpg",
    "bytes": 8164,
    "sha256": "c640fac38bbdf783c4bfb625fced747a282dd8ca26d693531f61156e587c67fa"
  }
}
