{
  "title": "Deep Space Climate Observatory (DSCOVR) (Triana)",
  "source": {
    "provider": "nasa",
    "url": "https://raw.githubusercontent.com/nasa/NASA-3D-Resources/11ebb4ee043715aefbba6aeec8a61746fad67fa7/3D%20Models/Deep%20Space%20Climate%20Observatory%20%28DSCOVR%29%20%28Triana%29/Deep%20Space%20Climate%20Observatory%20%28DSCOVR%29%20%28Triana%29.glb",
    "revision": "11ebb4ee043715aefbba6aeec8a61746fad67fa7",
    "original_file": "3D Models/Deep Space Climate Observatory (DSCOVR) (Triana)/Deep Space Climate Observatory (DSCOVR) (Triana).glb"
  },
  "rights": {
    "label": "NASA media guidelines",
    "url": "https://www.nasa.gov/nasa-brand-center/images-and-media/",
    "credit": "NASA 3D Resources; individual contributor credit should be retained where supplied",
    "public_export": true,
    "note": "NASA repository asset declaration applies; no endorsement. Logos and third-party rights remain separate. Repository meta.json also names NOSA 1.3; retained for review."
  },
  "representation": "mission_visualization",
  "display": {
    "native_extent": null,
    "reference_extent_m": null,
    "scale_basis": "unverified; preview auto-fit only",
    "forward_axis": "unverified",
    "browser_measured_extent": 266.3713092291
  },
  "aliases": [],
  "conversion": {
    "operation": "none",
    "note": "Original GLB bytes preserved."
  },
  "schema_version": 1,
  "asset_id": "dscovr",
  "category": "spacecraft/satellites",
  "purpose": "visual_only",
  "model": {
    "path": "model.glb",
    "bytes": 112488,
    "sha256": "265b703538b635128ffa32bc9f4d7b528ba6900e9ac1fbcf201dcdd54a5dadae"
  },
  "geometry": {
    "meshes": 1,
    "materials": 18,
    "animations": 0,
    "skins": 0,
    "required_extensions": [
      "KHR_draco_mesh_compression"
    ],
    "native_coordinates": "glTF right-handed +Y up; forward axis is asset-specific",
    "physical_dimensions_verified": false,
    "rendered_triangles": 8786
  },
  "validation": {
    "container": "passed",
    "gltf_validator": "passed",
    "browser": "passed",
    "gltf_validator_version": "2.0.0-dev.3.10",
    "gltf_errors": 0,
    "gltf_warnings": 0,
    "browser_scope": "Default scene load, shader compilation and one rendered frame. No animation/scale/flight-direction certification.",
    "browser_sha256": "265b703538b635128ffa32bc9f4d7b528ba6900e9ac1fbcf201dcdd54a5dadae"
  },
  "thumbnail": {
    "path": "thumbnail.jpg",
    "bytes": 5753,
    "sha256": "24fb361cd7ab255dcbd76b8f0cab10a3b8e89898f4c3caa7c3f39c95cd562619"
  }
}
