{
  "title": "CYGNSS",
  "source": {
    "provider": "nasa",
    "url": "https://github.com/nasa/NASA-3D-Resources/blob/11ebb4ee043715aefbba6aeec8a61746fad67fa7/3D%20Models/Cyclone Global Navigation Satellite System (CYGNSS)/Cyclone Global Navigation Satellite System (CYGNSS).glb",
    "revision": "11ebb4ee043715aefbba6aeec8a61746fad67fa7",
    "imported_from": "icdcdt",
    "original_file": "cygnss.glb"
  },
  "rights": {
    "label": "NASA media guidelines",
    "credit": "NASA 3D Resources",
    "url": "https://www.nasa.gov/nasa-brand-center/images-and-media/",
    "public_export": true,
    "note": "NASA attribution; no endorsement. Trademarks and third-party rights remain separate."
  },
  "representation": "mission_visualization",
  "aliases": [
    {
      "key": "cygnss",
      "label": "CYGNSS",
      "exact": {
        "norad": [],
        "names": [
          "^CYGNSS"
        ]
      },
      "series": {
        "norad": [],
        "names": []
      },
      "family": {
        "names": []
      },
      "size_m": 1.65,
      "orientation": {
        "heading": 0,
        "pitch": 0,
        "roll": 0
      },
      "extent": 1.590484
    }
  ],
  "display": {
    "native_extent": 1.590484,
    "reference_extent_m": 1.65,
    "scale_basis": "ICDCDT approximate display dimensions; not certified measurements",
    "orientation": {
      "heading": 0,
      "pitch": 0,
      "roll": 0
    },
    "browser_measured_extent": 1.5904837250709534
  },
  "conversion": {
    "operation": "none",
    "note": "Original GLB bytes preserved."
  },
  "schema_version": 1,
  "asset_id": "cygnss",
  "category": "spacecraft/satellites",
  "purpose": "visual_only",
  "model": {
    "path": "model.glb",
    "bytes": 1622924,
    "sha256": "830321f2d30099b4355f835d7ae5a2ab1f9f91c292dd01dfc008b8d4bf64c962"
  },
  "geometry": {
    "meshes": 18,
    "materials": 6,
    "animations": 0,
    "skins": 0,
    "required_extensions": [
      "KHR_draco_mesh_compression"
    ],
    "native_coordinates": "glTF right-handed +Y up; forward axis is asset-specific",
    "physical_dimensions_verified": false,
    "rendered_triangles": 7338
  },
  "validation": {
    "container": "passed",
    "gltf_validator": "passed",
    "browser": "passed",
    "gltf_validator_version": "2.0.0-dev.3.10",
    "gltf_errors": 0,
    "gltf_warnings": 1,
    "browser_scope": "Default scene load, shader compilation and one rendered frame. No animation/scale/flight-direction certification.",
    "browser_sha256": "830321f2d30099b4355f835d7ae5a2ab1f9f91c292dd01dfc008b8d4bf64c962"
  },
  "thumbnail": {
    "path": "thumbnail.jpg",
    "bytes": 8117,
    "sha256": "c7f4e91a39f2b403dd05e0c9c294ac5ae76703c9c723637e3a954ced4ed71ff4"
  }
}
