{
  "title": "Solar Dynamics Observatory",
  "source": {
    "provider": "nasa",
    "url": "https://github.com/nasa/NASA-3D-Resources/blob/11ebb4ee043715aefbba6aeec8a61746fad67fa7/3D%20Models/Solar Dynamics Observatory/Solar Dynamics Observatory.glb",
    "revision": "11ebb4ee043715aefbba6aeec8a61746fad67fa7",
    "imported_from": "icdcdt",
    "original_file": "sdo.glb"
  },
  "rights": {
    "label": "NASA media guidelines",
    "credit": "NASA 3D Resources",
    "url": "https://www.nasa.gov/nasa-brand-center/images-and-media/",
    "public_export": true,
    "note": "NASA attribution; no endorsement. Trademarks and third-party rights remain separate."
  },
  "representation": "mission_visualization",
  "aliases": [
    {
      "key": "sdo",
      "label": "Solar Dynamics Observatory",
      "exact": {
        "norad": [
          36395
        ],
        "names": [
          "^SDO$"
        ]
      },
      "series": {
        "norad": [],
        "names": []
      },
      "family": {
        "names": []
      },
      "size_m": 6.25,
      "orientation": {
        "heading": 0,
        "pitch": 0,
        "roll": 0
      },
      "extent": 37.034475
    }
  ],
  "display": {
    "native_extent": 37.034475,
    "reference_extent_m": 6.25,
    "scale_basis": "ICDCDT approximate display dimensions; not certified measurements",
    "orientation": {
      "heading": 0,
      "pitch": 0,
      "roll": 0
    },
    "browser_measured_extent": 37.034475326538086
  },
  "conversion": {
    "operation": "none",
    "note": "Original GLB bytes preserved."
  },
  "schema_version": 1,
  "asset_id": "sdo",
  "category": "spacecraft/satellites",
  "purpose": "visual_only",
  "model": {
    "path": "model.glb",
    "bytes": 497844,
    "sha256": "8ce4607bd65f098eee22f02717a182d6721610c940a961511dfbca832a3eda95"
  },
  "geometry": {
    "meshes": 1,
    "materials": 31,
    "animations": 0,
    "skins": 0,
    "required_extensions": [
      "KHR_draco_mesh_compression"
    ],
    "native_coordinates": "glTF right-handed +Y up; forward axis is asset-specific",
    "physical_dimensions_verified": false,
    "rendered_triangles": 272770
  },
  "validation": {
    "container": "passed",
    "gltf_validator": "passed",
    "browser": "passed",
    "gltf_validator_version": "2.0.0-dev.3.10",
    "gltf_errors": 0,
    "gltf_warnings": 0,
    "browser_scope": "Default scene load, shader compilation and one rendered frame. No animation/scale/flight-direction certification.",
    "browser_sha256": "8ce4607bd65f098eee22f02717a182d6721610c940a961511dfbca832a3eda95"
  },
  "thumbnail": {
    "path": "thumbnail.jpg",
    "bytes": 11078,
    "sha256": "cb7487ab887e85431bafb1c8a09ce763121f6326b8457fc6de6719d79ee02f73"
  }
}
