{
  "title": "3U 큐브샛",
  "source": {
    "provider": "spacetwin",
    "url": "",
    "revision": null,
    "imported_from": "icdcdt",
    "original_file": "cubesat_3u.glb"
  },
  "rights": {
    "label": "Project owner/provider review",
    "credit": "SpaceTwin 자체 제작",
    "url": "",
    "public_export": false,
    "note": "Local project use only pending owner/provider permission review; not cleared for public redistribution."
  },
  "representation": "generic",
  "aliases": [
    {
      "key": "cubesat_3u",
      "label": "3U 큐브샛",
      "exact": {
        "norad": [],
        "names": []
      },
      "series": {
        "norad": [],
        "names": []
      },
      "family": {
        "names": [
          "^FLOCK",
          "^DOVE",
          "^LEMUR",
          "\\b3U\\b"
        ]
      },
      "size_m": 0.7,
      "orientation": {
        "heading": 0,
        "pitch": 0,
        "roll": 0
      },
      "extent": 0.7
    }
  ],
  "display": {
    "native_extent": 0.7,
    "reference_extent_m": 0.7,
    "scale_basis": "ICDCDT approximate display dimensions; not certified measurements",
    "orientation": {
      "heading": 0,
      "pitch": 0,
      "roll": 0
    },
    "browser_measured_extent": 0.7
  },
  "conversion": {
    "operation": "none",
    "note": "Original GLB bytes preserved."
  },
  "schema_version": 1,
  "asset_id": "cubesat_3u",
  "category": "spacecraft/satellites",
  "purpose": "visual_only",
  "model": {
    "path": "model.glb",
    "bytes": 10608,
    "sha256": "8657ecec5c182900985c92b85281f49ca4c7859e1ff40b704aef7a54359d073f"
  },
  "geometry": {
    "meshes": 1,
    "materials": 6,
    "animations": 0,
    "skins": 0,
    "required_extensions": [],
    "native_coordinates": "glTF right-handed +Y up; forward axis is asset-specific",
    "physical_dimensions_verified": false,
    "rendered_triangles": 96
  },
  "validation": {
    "container": "passed",
    "gltf_validator": "passed",
    "browser": "passed",
    "gltf_validator_version": "2.0.0-dev.3.10",
    "gltf_errors": 0,
    "gltf_warnings": 0,
    "browser_scope": "Default scene load, shader compilation and one rendered frame. No animation/scale/flight-direction certification.",
    "browser_sha256": "8657ecec5c182900985c92b85281f49ca4c7859e1ff40b704aef7a54359d073f"
  },
  "thumbnail": {
    "path": "thumbnail.jpg",
    "bytes": 5855,
    "sha256": "5bd1ac99bcda749301806e1ad10dff75c70fe57b82952c46dcbcef40d11e03fe"
  }
}
