{
  "title": "Quick Scatterometer (QuikSCAT)",
  "source": {
    "provider": "nasa",
    "url": "https://raw.githubusercontent.com/nasa/NASA-3D-Resources/11ebb4ee043715aefbba6aeec8a61746fad67fa7/3D%20Models/Quick%20Scatterometer%20%28QuikSCAT%29/Quick%20Scatterometer%20%28QuikSCAT%29.glb",
    "revision": "11ebb4ee043715aefbba6aeec8a61746fad67fa7",
    "original_file": "3D Models/Quick Scatterometer (QuikSCAT)/Quick Scatterometer (QuikSCAT).glb"
  },
  "rights": {
    "label": "NASA media guidelines",
    "url": "https://www.nasa.gov/nasa-brand-center/images-and-media/",
    "credit": "NASA 3D Resources; individual contributor credit should be retained where supplied",
    "public_export": true,
    "note": "NASA repository asset declaration applies; no endorsement. Logos and third-party rights remain separate. Repository meta.json also names NOSA 1.3; retained for review."
  },
  "representation": "mission_visualization",
  "display": {
    "native_extent": null,
    "reference_extent_m": null,
    "scale_basis": "unverified; preview auto-fit only",
    "forward_axis": "unverified",
    "browser_measured_extent": 7.505924514846697
  },
  "aliases": [],
  "conversion": {
    "operation": "web_compatibility_repair",
    "tool": "asset_library.py",
    "source_sha256": "329e0214c4330cfc8366fc1c84cd1f2b3d8321a0a3c0ff90534e2845c1eaf554",
    "removed_uris": [],
    "changes": [
      "mesh 0 primitive 0: no UV; copied base-colour material without ['baseColorTexture']",
      "mesh 1 primitive 0: no UV; copied base-colour material without ['baseColorTexture']",
      "mesh 9 primitive 0: no UV; copied base-colour material without ['baseColorTexture']",
      "mesh 10 primitive 0: no UV; copied base-colour material without ['baseColorTexture']",
      "mesh 11 primitive 0: no UV; copied base-colour material without ['baseColorTexture']"
    ],
    "note": "Vertex positions preserved. Missing texture/UV surfaces use base colours; undefined normals use a lighting fallback. Appearance is not guaranteed identical. mesh 0 primitive 0: no UV; copied base-colour material without ['baseColorTexture']; mesh 1 primitive 0: no UV; copied base-colour material without ['baseColorTexture']; mesh 9 primitive 0: no UV; copied base-colour material without ['baseColorTexture']; mesh 10 primitive 0: no UV; copied base-colour material without ['baseColorTexture']; mesh 11 primitive 0: no UV; copied base-colour material without ['baseColorTexture']"
  },
  "schema_version": 1,
  "asset_id": "quikscat",
  "category": "spacecraft/satellites",
  "purpose": "visual_only",
  "model": {
    "path": "model.glb",
    "bytes": 4462684,
    "sha256": "fb95529d5402f705e4650e66b58c9e02b4ec3eff967d38f0dcbb7b35069cd734"
  },
  "geometry": {
    "meshes": 12,
    "materials": 20,
    "animations": 0,
    "skins": 0,
    "required_extensions": [
      "KHR_draco_mesh_compression"
    ],
    "native_coordinates": "glTF right-handed +Y up; forward axis is asset-specific",
    "physical_dimensions_verified": false,
    "rendered_triangles": 67793
  },
  "validation": {
    "container": "passed",
    "gltf_validator": "passed",
    "browser": "passed",
    "gltf_validator_version": "2.0.0-dev.3.10",
    "gltf_errors": 0,
    "gltf_warnings": 0,
    "browser_scope": "Default scene load, shader compilation and one rendered frame. No animation/scale/flight-direction certification.",
    "browser_sha256": "fb95529d5402f705e4650e66b58c9e02b4ec3eff967d38f0dcbb7b35069cd734"
  },
  "thumbnail": {
    "path": "thumbnail.jpg",
    "bytes": 11891,
    "sha256": "1c1463cb71b3fe4a4afd66e32e343c73a1f63048b705be16fdada53ae0400fce"
  }
}
