{
  "title": "Polar",
  "source": {
    "provider": "nasa",
    "url": "https://github.com/nasa/NASA-3D-Resources/blob/11ebb4ee043715aefbba6aeec8a61746fad67fa7/3D%20Models/Polar/Polar.glb",
    "revision": "11ebb4ee043715aefbba6aeec8a61746fad67fa7",
    "imported_from": "icdcdt",
    "original_file": "polar.glb"
  },
  "rights": {
    "label": "NASA media guidelines",
    "credit": "NASA 3D Resources",
    "url": "https://www.nasa.gov/nasa-brand-center/images-and-media/",
    "public_export": true,
    "note": "NASA attribution; no endorsement. Trademarks and third-party rights remain separate."
  },
  "representation": "mission_visualization",
  "aliases": [
    {
      "key": "polar",
      "label": "Polar",
      "exact": {
        "norad": [
          23802
        ],
        "names": [
          "^POLAR$"
        ]
      },
      "series": {
        "norad": [],
        "names": []
      },
      "family": {
        "names": []
      },
      "size_m": 6,
      "orientation": {
        "heading": 0,
        "pitch": 0,
        "roll": 0
      },
      "extent": 26.931483
    }
  ],
  "display": {
    "native_extent": 26.931483,
    "reference_extent_m": 6,
    "scale_basis": "ICDCDT approximate display dimensions; not certified measurements",
    "orientation": {
      "heading": 0,
      "pitch": 0,
      "roll": 0
    },
    "browser_measured_extent": 26.93148314049644,
    "preview_note": "Default full-scene thumbnail has a small silhouette. Dedicated framing/scale review recommended; browser loading is not a visual-quality certification."
  },
  "conversion": {
    "operation": "none",
    "note": "Original GLB bytes preserved."
  },
  "schema_version": 1,
  "asset_id": "polar",
  "category": "spacecraft/satellites",
  "purpose": "visual_only",
  "model": {
    "path": "model.glb",
    "bytes": 98592,
    "sha256": "0ffe9e41f6686db7dcaf3144f967f0f419e72b6a90218d955b1654cf0478801d"
  },
  "geometry": {
    "meshes": 11,
    "materials": 11,
    "animations": 0,
    "skins": 0,
    "required_extensions": [
      "KHR_draco_mesh_compression"
    ],
    "native_coordinates": "glTF right-handed +Y up; forward axis is asset-specific",
    "physical_dimensions_verified": false,
    "rendered_triangles": 20656
  },
  "validation": {
    "container": "passed",
    "gltf_validator": "passed",
    "browser": "passed",
    "gltf_validator_version": "2.0.0-dev.3.10",
    "gltf_errors": 0,
    "gltf_warnings": 0,
    "browser_scope": "Default scene load, shader compilation and one rendered frame. No animation/scale/flight-direction certification.",
    "browser_sha256": "0ffe9e41f6686db7dcaf3144f967f0f419e72b6a90218d955b1654cf0478801d"
  },
  "thumbnail": {
    "path": "thumbnail.jpg",
    "bytes": 2188,
    "sha256": "0f66e824e599f77d803c068f38c2357292bd31a5b97189588264a93329064877"
  }
}
